{
  "pack_version": 1,
  "pack_type": "reasoning_handoff_pack",
  "source_manifest_ref": "mechanics/checkpoint/parts/reasoning-handoff/manifests/reasoning_handoff_pack.json",
  "source_inputs": [
    {
      "name": "reasoning_handoff_doc",
      "repo": "aoa-kag",
      "role": "kag_guardrail_doc",
      "ref": "mechanics/checkpoint/parts/reasoning-handoff/docs/reasoning-handoff.md"
    },
    {
      "name": "reasoning_handoff_schema",
      "repo": "aoa-kag",
      "role": "kag_guardrail_schema",
      "ref": "mechanics/checkpoint/parts/reasoning-handoff/schemas/reasoning-handoff-guardrail.schema.json"
    },
    {
      "name": "counterpart_consumer_contract_doc",
      "repo": "aoa-kag",
      "role": "kag_guardrail_doc",
      "ref": "mechanics/boundary-bridge/parts/counterpart-edge/docs/counterpart-consumer-contract.md"
    },
    {
      "name": "counterpart_consumer_contract_schema",
      "repo": "aoa-kag",
      "role": "kag_guardrail_schema",
      "ref": "mechanics/boundary-bridge/parts/counterpart-edge/schemas/counterpart-consumer-contract.schema.json"
    },
    {
      "name": "counterpart_consumer_contract_example",
      "repo": "aoa-kag",
      "role": "kag_guardrail_example",
      "ref": "mechanics/boundary-bridge/parts/counterpart-edge/examples/counterpart_consumer_contract.example.json"
    },
    {
      "name": "counterpart_federation_exposure_review_doc",
      "repo": "aoa-kag",
      "role": "kag_guardrail_doc",
      "ref": "mechanics/audit/parts/exposure-review/docs/counterpart-federation-exposure-review.md"
    },
    {
      "name": "artifact_to_verdict_hook_schema",
      "repo": "aoa-evals",
      "role": "eval_hook_schema",
      "ref": "aoa-evals/mechanics/audit/parts/artifact-verdict-hooks/schemas/artifact-to-verdict-hook.schema.json"
    },
    {
      "name": "aoa_p_0008_playbook",
      "repo": "aoa-playbooks",
      "role": "playbook_doc",
      "ref": "aoa-playbooks/playbooks/operations/orchestration/long-horizon-model-tier-orchestra/PLAYBOOK.md"
    },
    {
      "name": "aoa_p_0008_hook",
      "repo": "aoa-evals",
      "role": "eval_hook_fixture",
      "ref": "aoa-evals/mechanics/audit/parts/artifact-verdict-hooks/examples/artifact_to_verdict_hook.long-horizon-model-tier-orchestra.example.json"
    },
    {
      "name": "aoa_p_0009_playbook",
      "repo": "aoa-playbooks",
      "role": "playbook_doc",
      "ref": "aoa-playbooks/playbooks/continuity/session-growth/restartable-inquiry-loop/PLAYBOOK.md"
    },
    {
      "name": "aoa_p_0009_hook",
      "repo": "aoa-evals",
      "role": "eval_hook_fixture",
      "ref": "aoa-evals/mechanics/checkpoint/parts/restartable-inquiry/examples/artifact_to_verdict_hook.restartable-inquiry-loop.example.json"
    },
    {
      "name": "checkpoint_to_memory_contract",
      "repo": "aoa-memo",
      "role": "memo_contract_fixture",
      "ref": "aoa-memo/mechanics/checkpoint/parts/checkpoint-to-memory-mapping/examples/checkpoint_to_memory_contract.example.json"
    },
    {
      "name": "inquiry_checkpoint_schema",
      "repo": "aoa-memo",
      "role": "memo_schema",
      "ref": "aoa-memo/mechanics/checkpoint/parts/checkpoint-carry-contract/schemas/inquiry_checkpoint.schema.json"
    },
    {
      "name": "witness_trace_contract",
      "repo": "aoa-memo",
      "role": "memo_doc",
      "ref": "aoa-memo/mechanics/recurrence-support/docs/WITNESS_TRACE_CONTRACT.md"
    },
    {
      "name": "witness_trace_schema",
      "repo": "aoa-memo",
      "role": "memo_schema",
      "ref": "aoa-memo/mechanics/recurrence-support/parts/witness-trace-contract/schemas/witness-trace.schema.json"
    }
  ],
  "scenario_count": 2,
  "scenarios": [
    {
      "scenario_ref": "AOA-P-0008",
      "playbook_ref": "aoa-playbooks/playbooks/operations/orchestration/long-horizon-model-tier-orchestra/PLAYBOOK.md",
      "artifact_spine": {
        "verification_surface": {
          "artifact_name": "verification_result",
          "contract_strength": "schema_backed",
          "artifact_contract_refs": [
            "aoa-agents/mechanics/runtime-seam/parts/artifact-contracts/schemas/artifact.verification_result.schema.json"
          ]
        },
        "continuity_surface": null,
        "supporting_artifacts": [
          {
            "artifact_name": "route_decision",
            "contract_strength": "schema_backed",
            "artifact_contract_refs": [
              "aoa-agents/mechanics/runtime-seam/parts/artifact-contracts/schemas/artifact.route_decision.schema.json"
            ]
          },
          {
            "artifact_name": "bounded_plan",
            "contract_strength": "schema_backed",
            "artifact_contract_refs": [
              "aoa-agents/mechanics/runtime-seam/parts/artifact-contracts/schemas/artifact.bounded_plan.schema.json"
            ]
          },
          {
            "artifact_name": "transition_decision",
            "contract_strength": "schema_backed",
            "artifact_contract_refs": [
              "aoa-agents/mechanics/runtime-seam/parts/artifact-contracts/schemas/artifact.transition_decision.schema.json"
            ]
          },
          {
            "artifact_name": "distillation_pack",
            "contract_strength": "schema_backed",
            "artifact_contract_refs": [
              "aoa-agents/mechanics/runtime-seam/parts/artifact-contracts/schemas/artifact.distillation_pack.schema.json"
            ]
          }
        ],
        "optional_trace_sidecars": [
          {
            "artifact_name": "WitnessTrace",
            "contract_strength": "doc_backed",
            "artifact_contract_refs": [
              "aoa-memo/mechanics/recurrence-support/docs/WITNESS_TRACE_CONTRACT.md"
            ]
          }
        ]
      },
      "eval_bridge": {
        "eval_anchor_refs": [
          "aoa-evals/evals/workflow/aoa-long-horizon-depth/EVAL.md",
          "aoa-evals/evals/workflow/aoa-tool-trajectory-discipline/EVAL.md"
        ],
        "verification_surface": "verification_result",
        "trace_surfaces": [
          "aoa-memo/mechanics/recurrence-support/docs/WITNESS_TRACE_CONTRACT.md"
        ],
        "artifact_contract_refs": [
          "aoa-agents/mechanics/runtime-seam/parts/artifact-contracts/schemas/artifact.route_decision.schema.json",
          "aoa-agents/mechanics/runtime-seam/parts/artifact-contracts/schemas/artifact.bounded_plan.schema.json",
          "aoa-agents/mechanics/runtime-seam/parts/artifact-contracts/schemas/artifact.verification_result.schema.json",
          "aoa-agents/mechanics/runtime-seam/parts/artifact-contracts/schemas/artifact.transition_decision.schema.json",
          "aoa-agents/mechanics/runtime-seam/parts/artifact-contracts/schemas/artifact.distillation_pack.schema.json"
        ],
        "report_expectation": {
          "report_format": "summary-with-breakdown",
          "verdict_shape": "categorical",
          "review_required": true
        }
      },
      "memo_bridge": {
        "memo_contract_refs": [
          "aoa-memo/examples/recall/recall_contract.router.semantic.json",
          "aoa-memo/mechanics/checkpoint/parts/checkpoint-to-memory-mapping/examples/checkpoint_to_memory_contract.example.json"
        ],
        "memo_writeback_targets": [
          "decision",
          "claim",
          "pattern"
        ],
        "delta_split": null
      },
      "compatible_query_modes": [
        "local_search",
        "global_search",
        "drift_search"
      ],
      "authoritative_refs": {
        "playbook_refs": [
          "aoa-playbooks/playbooks/operations/orchestration/long-horizon-model-tier-orchestra/PLAYBOOK.md"
        ],
        "eval_refs": [
          "aoa-evals/evals/workflow/aoa-long-horizon-depth/EVAL.md",
          "aoa-evals/evals/workflow/aoa-tool-trajectory-discipline/EVAL.md",
          "aoa-evals/evals/workflow/aoa-tool-trajectory-discipline/checks/eval-integrity-check.md",
          "aoa-evals/evals/workflow/aoa-tool-trajectory-discipline/notes/bounded-promotion-review.md",
          "aoa-evals/evals/workflow/aoa-tool-trajectory-discipline/notes/proof-surface-contract.md"
        ],
        "memo_refs": [
          "aoa-memo/examples/recall/recall_contract.router.semantic.json",
          "aoa-memo/mechanics/checkpoint/parts/checkpoint-to-memory-mapping/examples/checkpoint_to_memory_contract.example.json",
          "aoa-memo/mechanics/recurrence-support/docs/WITNESS_TRACE_CONTRACT.md"
        ],
        "kag_guardrail_refs": [
          "mechanics/checkpoint/parts/reasoning-handoff/docs/reasoning-handoff.md",
          "mechanics/checkpoint/parts/reasoning-handoff/schemas/reasoning-handoff-guardrail.schema.json",
          "mechanics/boundary-bridge/parts/counterpart-edge/docs/counterpart-consumer-contract.md",
          "mechanics/boundary-bridge/parts/counterpart-edge/schemas/counterpart-consumer-contract.schema.json",
          "mechanics/boundary-bridge/parts/counterpart-edge/examples/counterpart_consumer_contract.example.json",
          "mechanics/audit/parts/exposure-review/docs/counterpart-federation-exposure-review.md"
        ],
        "artifact_schema_refs": [
          "aoa-agents/mechanics/runtime-seam/parts/artifact-contracts/schemas/artifact.route_decision.schema.json",
          "aoa-agents/mechanics/runtime-seam/parts/artifact-contracts/schemas/artifact.bounded_plan.schema.json",
          "aoa-agents/mechanics/runtime-seam/parts/artifact-contracts/schemas/artifact.verification_result.schema.json",
          "aoa-agents/mechanics/runtime-seam/parts/artifact-contracts/schemas/artifact.transition_decision.schema.json",
          "aoa-agents/mechanics/runtime-seam/parts/artifact-contracts/schemas/artifact.distillation_pack.schema.json",
          "aoa-memo/mechanics/recurrence-support/parts/witness-trace-contract/schemas/witness-trace.schema.json"
        ]
      },
      "return_contract": {
        "must_include": [
          "source_refs",